{
  "$schema": "https://json-schema.org/draft/2020-12/schema",
  "$id": "https://robocert.dev/schemas/0.1.0/problem.schema.json",
  "title": "RoboCert Planar-2R Certification Problem",
  "description": "User-facing input for `robocert certify`. Every numeric quantity is written as a decimal string or an integer and parsed to an exact rational; JSON float literals are rejected so no value silently loses precision.",
  "type": "object",
  "additionalProperties": false,
  "required": [
    "schema_version",
    "problem_id",
    "robot",
    "joint_limits",
    "task",
    "margins"
  ],
  "properties": {
    "schema_version": { "const": "0.1.0" },
    "problem_id": {
      "type": "string",
      "pattern": "^[A-Za-z][A-Za-z0-9_.:-]*$"
    },
    "robot": {
      "type": "object",
      "additionalProperties": false,
      "required": ["kind", "link_lengths"],
      "properties": {
        "kind": { "const": "planar_2r" },
        "link_lengths": {
          "type": "array",
          "minItems": 2,
          "maxItems": 2,
          "items": { "$ref": "#/$defs/exactNumber" },
          "description": "[L1, L2], both strictly positive."
        }
      }
    },
    "joint_limits": {
      "type": "object",
      "additionalProperties": false,
      "required": ["q1", "q2"],
      "properties": {
        "q1": { "$ref": "#/$defs/interval" },
        "q2": { "$ref": "#/$defs/interval" }
      },
      "description": "Radian intervals, each strictly inside (-pi, pi). Converted to exact rational tan(q/2) bounds by INWARD rounding, so the certified interval is a subset of the one requested."
    },
    "task": {
      "type": "object",
      "additionalProperties": false,
      "required": ["target"],
      "properties": {
        "target": {
          "type": "array",
          "minItems": 2,
          "maxItems": 2,
          "items": { "$ref": "#/$defs/exactNumber" },
          "description": "Requested tool point [x, y]. The certified point is the exact rational point the witness reaches; its deviation from this request is reported exactly."
        }
      }
    },
    "obstacle": {
      "type": "object",
      "additionalProperties": false,
      "required": ["kind", "center", "radius"],
      "properties": {
        "kind": { "const": "circle" },
        "center": {
          "type": "array",
          "minItems": 2,
          "maxItems": 2,
          "items": { "$ref": "#/$defs/exactNumber" }
        },
        "radius": { "$ref": "#/$defs/exactNumber" }
      },
      "description": "Optional. Omitted means no obstacle is modeled, which is not the same as certifying that none is present."
    },
    "margins": {
      "type": "object",
      "additionalProperties": false,
      "required": ["clearance", "singularity"],
      "properties": {
        "clearance": {
          "$ref": "#/$defs/exactNumber",
          "description": "Required separation beyond the obstacle radius, strictly positive."
        },
        "singularity": {
          "$ref": "#/$defs/exactNumber",
          "description": "Lower bound on |det J| in square length units, strictly positive and at most |L1*L2| (proof P2 Corollary 5.4; larger is unsatisfiable for every configuration)."
        }
      }
    },
    "units": {
      "type": "object",
      "additionalProperties": false,
      "properties": {
        "length": { "const": "metre" },
        "angle": { "const": "radian" }
      },
      "description": "Declarative only; the certificate is dimensionless arithmetic over the supplied numbers. Mixing units is the caller's error to avoid (AGENTS.md 22.2)."
    }
  },
  "$defs": {
    "exactNumber": {
      "oneOf": [
        { "type": "integer" },
        {
          "type": "string",
          "pattern": "^-?[0-9]+(\\.[0-9]+)?(/[0-9]+)?$",
          "description": "Decimal string such as \"7.8\", or a rational such as \"39/5\". Parsed exactly."
        }
      ]
    },
    "interval": {
      "type": "array",
      "minItems": 2,
      "maxItems": 2,
      "items": { "$ref": "#/$defs/exactNumber" }
    }
  }
}
